tcpdump: verbose output suppressed, use -v or -vv for full protocol decode
listening on wlan0, link-type EN10MB (Ethernet), capture size 262144 bytes
23:47:12.229088 IP ip-192-168-1-10.us-west-2.compute.internal.38478 > sea30s01-in-f14.1e100.net.www: Flags [S], seq 1838428126, win 65535, options [mss 1460,sackOK,TS val 1526830 ecr 0,nop,wscale 7], length 0
23:47:12.236802 IP sea30s01-in-f14.1e100.net.www > ip-192-168-1-10.us-west-2.compute.internal.38478: Flags [S.], seq 584968624, ack 1838428127, win 26960, options [mss 1360,sackOK,TS val 1004954776 ecr 1526830,nop,wscale 7], length 0
23:47:12.253196 IP ip-192-168-1-10.us-west-2.compute.internal.38478 > sea30s01-in-f14.1e100.net.www: Flags [.], ack 1, win 685, options [nop,nop,TS val 1526835 ecr 1004954776], length 0
23:47:12.256835 IP ip-192-168-1-10.us-west-2.compute.internal.38478 > sea30s01-in-f14.1e100.net.www: Flags [P.], seq 1:180, ack 1, win 685, options [nop,nop,TS val 1526835 ecr 1004954776], length 179: HTTP: GET /generate_204 HTTP/1.1
23:47:12.264743 IP sea30s01-in-f14.1e100.net.www > ip-192-168-1-10.us-west-2.compute.internal.38478: Flags [.], ack 180, win 219, options [nop,nop,TS val 1004954803 ecr 1526835], length 0
23:47:12.335537 IP sea30s01-in-f14.1e100.net.www > ip-192-168-1-10.us-west-2.compute.internal.38478: Flags [P.], seq 1:227, ack 180, win 219, options [nop,nop,TS val 1004954874 ecr 1526835], length 226: HTTP: HTTP/1.1 204 No Content
23:47:12.346605 IP ip-192-168-1-10.us-west-2.compute.internal.38478 > sea30s01-in-f14.1e100.net.www: Flags [.], ack 227, win 693, options [nop,nop,TS val 1526853 ecr 1004954874], length 0
23:47:13.640133 IP ip-192-168-1-10.us-west-2.compute.internal.45720 > sfo03s18-in-f10.1e100.net.https: Flags [S], seq 1048256979, win 65535, options [mss 1460,sackOK,TS val 1527112 ecr 0,nop,wscale 7], length 0
23:47:13.672172 IP sfo03s18-in-f10.1e100.net.https > ip-192-168-1-10.us-west-2.compute.internal.45720: Flags [S.], seq 2525381693, ack 1048256980, win 60192, options [mss 1360,sackOK,TS val 3899857680 ecr 1527112,nop,wscale 8], length 0
23:47:13.677601 IP ip-192-168-1-10.us-west-2.compute.internal.45720 > sfo03s18-in-f10.1e100.net.https: Flags [.], ack 1, win 685, options [nop,nop,TS val 1527120 ecr 3899857680], length 0
23:47:13.711766 IP ip-192-168-1-10.us-west-2.compute.internal.45720 > sfo03s18-in-f10.1e100.net.https: Flags [P.], seq 1:166, ack 1, win 685, options [nop,nop,TS val 1527126 ecr 3899857680], length 165
23:47:13.743601 IP sfo03s18-in-f10.1e100.net.https > ip-192-168-1-10.us-west-2.compute.internal.45720: Flags [.], ack 166, win 240, options [nop,nop,TS val 3899857751 ecr 1527126], length 0
23:47:13.761537 IP sfo03s18-in-f10.1e100.net.https > ip-192-168-1-10.us-west-2.compute.internal.45720: Flags [.], seq 1:1349, ack 166, win 240, options [nop,nop,TS val 3899857769 ecr 1527126], length 1348
23:47:13.761634 IP sfo03s18-in-f10.1e100.net.https > ip-192-168-1-10.us-west-2.compute.internal.45720: Flags [.], seq 1349:2697, ack 166, win 240, options [nop,nop,TS val 3899857769 ecr 1527126], length 1348
23:47:13.763977 IP sfo03s18-in-f10.1e100.net.https > ip-192-168-1-10.us-west-2.compute.internal.45720: Flags [P.], seq 2697:3615, ack 166, win 240, options [nop,nop,TS val 3899857769 ecr 1527126], length 918
23:47:13.771085 IP ip-192-168-1-10.us-west-2.compute.internal.45720 > sfo03s18-in-f10.1e100.net.https: Flags [.], ack 1349, win 707, options [nop,nop,TS val 1527138 ecr 3899857769], length 0
23:47:13.787572 IP ip-192-168-1-10.us-west-2.compute.internal.45720 > sfo03s18-in-f10.1e100.net.https: Flags [.], ack 2697, win 730, options [nop,nop,TS val 1527142 ecr 3899857769], length 0
23:47:13.788434 IP ip-192-168-1-10.us-west-2.compute.internal.45720 > sfo03s18-in-f10.1e100.net.https: Flags [.], ack 3615, win 751, options [nop,nop,TS val 1527142 ecr 3899857769], length 0
23:47:13.796343 IP ip-192-168-1-10.us-west-2.compute.internal.36844 > sea15s11-in-f14.1e100.net.https: Flags [S], seq 1942242379, win 65535, options [mss 1460,sackOK,TS val 1527143 ecr 0,nop,wscale 7], length 0
23:47:13.812418 IP sea15s11-in-f14.1e100.net.https > ip-192-168-1-10.us-west-2.compute.internal.36844: Flags [S.], seq 2499154370, ack 1942242380, win 60192, options [mss 1360,sackOK,TS val 1263605149 ecr 1527143,nop,wscale 8], length 0
23:47:13.819477 IP ip-192-168-1-10.us-west-2.compute.internal.36844 > sea15s11-in-f14.1e100.net.https: Flags [.], ack 1, win 685, options [nop,nop,TS val 1527148 ecr 1263605149], length 0
23:47:13.826857 IP ip-192-168-1-10.us-west-2.compute.internal.36844 > sea15s11-in-f14.1e100.net.https: Flags [P.], seq 1:174, ack 1, win 685, options [nop,nop,TS val 1527150 ecr 1263605149], length 173
23:47:13.841999 IP sea15s11-in-f14.1e100.net.https > ip-192-168-1-10.us-west-2.compute.internal.36844: Flags [.], ack 174, win 240, options [nop,nop,TS val 1263605179 ecr 1527150], length 0
23:47:13.849354 IP sea15s11-in-f14.1e100.net.https > ip-192-168-1-10.us-west-2.compute.internal.36844: Flags [.], seq 1:1349, ack 174, win 240, options [nop,nop,TS val 1263605186 ecr 1527150], length 1348
23:47:13.849460 IP sea15s11-in-f14.1e100.net.https > ip-192-168-1-10.us-west-2.compute.internal.36844: Flags [.], seq 1349:2697, ack 174, win 240, options [nop,nop,TS val 1263605186 ecr 1527150], length 1348
23:47:13.850594 IP sea15s11-in-f14.1e100.net.https > ip-192-168-1-10.us-west-2.compute.internal.36844: Flags [P.], seq 2697:3430, ack 174, win 240, options [nop,nop,TS val 1263605186 ecr 1527150], length 733
23:47:13.862285 IP ip-192-168-1-10.us-west-2.compute.internal.36844 > sea15s11-in-f14.1e100.net.https: Flags [.], ack 1349, win 707, options [nop,nop,TS val 1527156 ecr 1263605186], length 0
23:47:13.862938 IP ip-192-168-1-10.us-west-2.compute.internal.36844 > sea15s11-in-f14.1e100.net.https: Flags [.], ack 2697, win 730, options [nop,nop,TS val 1527157 ecr 1263605186], length 0
23:47:13.863075 IP ip-192-168-1-10.us-west-2.compute.internal.36844 > sea15s11-in-f14.1e100.net.https: Flags [.], ack 3430, win 751, options [nop,nop,TS val 1527157 ecr 1263605186], length 0
23:47:13.921970 IP ip-192-168-1-10.us-west-2.compute.internal.45720 > sfo03s18-in-f10.1e100.net.https: Flags [P.], seq 166:251, ack 3615, win 751, options [nop,nop,TS val 1527169 ecr 3899857769], length 85
23:47:13.943172 IP ip-192-168-1-10.us-west-2.compute.internal.36844 > sea15s11-in-f14.1e100.net.https: Flags [P.], seq 174:259, ack 3430, win 751, options [nop,nop,TS val 1527173 ecr 1263605186], length 85
23:47:13.953909 IP sfo03s18-in-f10.1e100.net.https > ip-192-168-1-10.us-west-2.compute.internal.45720: Flags [P.], seq 3615:3658, ack 251, win 240, options [nop,nop,TS val 3899857962 ecr 1527169], length 43
23:47:13.955829 IP ip-192-168-1-10.us-west-2.compute.internal.45720 > sfo03s18-in-f10.1e100.net.https: Flags [.], ack 3658, win 751, options [nop,nop,TS val 1527175 ecr 3899857962], length 0
23:47:13.960236 IP sea15s11-in-f14.1e100.net.https > ip-192-168-1-10.us-west-2.compute.internal.36844: Flags [P.], seq 3430:3473, ack 259, win 240, options [nop,nop,TS val 1263605296 ecr 1527173], length 43
23:47:13.962048 IP ip-192-168-1-10.us-west-2.compute.internal.36844 > sea15s11-in-f14.1e100.net.https: Flags [.], ack 3473, win 751, options [nop,nop,TS val 1527177 ecr 1263605296], length 0
23:47:14.035751 IP ip-192-168-1-10.us-west-2.compute.internal.45720 > sfo03s18-in-f10.1e100.net.https: Flags [.], seq 251:1599, ack 3658, win 751, options [nop,nop,TS val 1527191 ecr 3899857962], length 1348
23:47:14.036026 IP ip-192-168-1-10.us-west-2.compute.internal.45720 > sfo03s18-in-f10.1e100.net.https: Flags [.], seq 1599:2947, ack 3658, win 751, options [nop,nop,TS val 1527191 ecr 3899857962], length 1348
23:47:14.036156 IP ip-192-168-1-10.us-west-2.compute.internal.45720 > sfo03s18-in-f10.1e100.net.https: Flags [P.], seq 2947:3615, ack 3658, win 751, options [nop,nop,TS val 1527191 ecr 3899857962], length 668
23:47:14.038087 IP ip-192-168-1-10.us-west-2.compute.internal.36844 > sea15s11-in-f14.1e100.net.https: Flags [P.], seq 259:813, ack 3473, win 751, options [nop,nop,TS val 1527192 ecr 1263605296], length 554
23:47:14.067838 IP sfo03s18-in-f10.1e100.net.https > ip-192-168-1-10.us-west-2.compute.internal.45720: Flags [.], ack 2947, win 261, options [nop,nop,TS val 3899858075 ecr 1527191], length 0
23:47:14.092727 IP sea15s11-in-f14.1e100.net.https > ip-192-168-1-10.us-west-2.compute.internal.36844: Flags [.], ack 813, win 244, options [nop,nop,TS val 1263605429 ecr 1527192], length 0
23:47:14.107681 IP sea15s11-in-f14.1e100.net.https > ip-192-168-1-10.us-west-2.compute.internal.36844: Flags [P.], seq 3473:3877, ack 813, win 244, options [nop,nop,TS val 1263605444 ecr 1527192], length 404
23:47:14.107912 IP sea15s11-in-f14.1e100.net.https > ip-192-168-1-10.us-west-2.compute.internal.36844: Flags [P.], seq 3877:4141, ack 813, win 244, options [nop,nop,TS val 1263605444 ecr 1527192], length 264
23:47:14.108059 IP sea15s11-in-f14.1e100.net.https > ip-192-168-1-10.us-west-2.compute.internal.36844: Flags [P.], seq 4141:4167, ack 813, win 244, options [nop,nop,TS val 1263605444 ecr 1527192], length 26
23:47:14.108145 IP sfo03s18-in-f10.1e100.net.https > ip-192-168-1-10.us-west-2.compute.internal.45720: Flags [.], ack 3615, win 272, options [nop,nop,TS val 3899858116 ecr 1527191], length 0
23:47:14.111104 IP ip-192-168-1-10.us-west-2.compute.internal.36844 > sea15s11-in-f14.1e100.net.https: Flags [.], ack 3877, win 772, options [nop,nop,TS val 1527206 ecr 1263605444], length 0
23:47:14.111938 IP ip-192-168-1-10.us-west-2.compute.internal.36844 > sea15s11-in-f14.1e100.net.https: Flags [.], ack 4141, win 793, options [nop,nop,TS val 1527207 ecr 1263605444], length 0
23:47:14.112291 IP ip-192-168-1-10.us-west-2.compute.internal.36844 > sea15s11-in-f14.1e100.net.https: Flags [.], ack 4167, win 793, options [nop,nop,TS val 1527207 ecr 1263605444], length 0
23:47:14.165898 IP sfo03s18-in-f10.1e100.net.https > ip-192-168-1-10.us-west-2.compute.internal.45720: Flags [P.], seq 3658:5006, ack 3615, win 272, options [nop,nop,TS val 3899858173 ecr 1527191], length 1348
23:47:14.167663 IP sfo03s18-in-f10.1e100.net.https > ip-192-168-1-10.us-west-2.compute.internal.45720: Flags [P.], seq 5006:6354, ack 3615, win 272, options [nop,nop,TS val 3899858173 ecr 1527191], length 1348
23:47:14.169026 IP sfo03s18-in-f10.1e100.net.https > ip-192-168-1-10.us-west-2.compute.internal.45720: Flags [.], seq 6354:7702, ack 3615, win 272, options [nop,nop,TS val 3899858173 ecr 1527191], length 1348
23:47:14.169085 IP sfo03s18-in-f10.1e100.net.https > ip-192-168-1-10.us-west-2.compute.internal.45720: Flags [.], seq 7702:9050, ack 3615, win 272, options [nop,nop,TS val 3899858173 ecr 1527191], length 1348
23:47:14.169213 IP ip-192-168-1-10.us-west-2.compute.internal.45720 > sfo03s18-in-f10.1e100.net.https: Flags [.], ack 5006, win 774, options [nop,nop,TS val 1527218 ecr 3899858173], length 0
23:47:14.171820 IP sfo03s18-in-f10.1e100.net.https > ip-192-168-1-10.us-west-2.compute.internal.45720: Flags [.], seq 9050:10398, ack 3615, win 272, options [nop,nop,TS val 3899858173 ecr 1527191], length 1348
23:47:14.171877 IP sfo03s18-in-f10.1e100.net.https > ip-192-168-1-10.us-west-2.compute.internal.45720: Flags [.], seq 10398:11746, ack 3615, win 272, options [nop,nop,TS val 3899858173 ecr 1527191], length 1348
23:47:14.173294 IP ip-192-168-1-10.us-west-2.compute.internal.45720 > sfo03s18-in-f10.1e100.net.https: Flags [.], ack 6354, win 796, options [nop,nop,TS val 1527218 ecr 3899858173], length 0
23:47:14.173311 IP ip-192-168-1-10.us-west-2.compute.internal.45720 > sfo03s18-in-f10.1e100.net.https: Flags [.], ack 7702, win 819, options [nop,nop,TS val 1527219 ecr 3899858173], length 0
23:47:14.173527 IP sfo03s18-in-f10.1e100.net.https > ip-192-168-1-10.us-west-2.compute.internal.45720: Flags [.], seq 11746:13094, ack 3615, win 272, options [nop,nop,TS val 3899858176 ecr 1527191], length 1348
23:47:14.173574 IP sfo03s18-in-f10.1e100.net.https > ip-192-168-1-10.us-west-2.compute.internal.45720: Flags [.], seq 13094:14442, ack 3615, win 272, options [nop,nop,TS val 3899858176 ecr 1527191], length 1348
23:47:14.174289 IP ip-192-168-1-10.us-west-2.compute.internal.45720 > sfo03s18-in-f10.1e100.net.https: Flags [.], ack 9050, win 842, options [nop,nop,TS val 1527219 ecr 3899858173], length 0
23:47:14.176217 IP sfo03s18-in-f10.1e100.net.https > ip-192-168-1-10.us-west-2.compute.internal.45720: Flags [.], seq 14442:15790, ack 3615, win 272, options [nop,nop,TS val 3899858179 ecr 1527191], length 1348
23:47:14.176269 IP sfo03s18-in-f10.1e100.net.https > ip-192-168-1-10.us-west-2.compute.internal.45720: Flags [.], seq 15790:17138, ack 3615, win 272, options [nop,nop,TS val 3899858179 ecr 1527191], length 1348
23:47:14.178045 IP ip-192-168-1-10.us-west-2.compute.internal.45720 > sfo03s18-in-f10.1e100.net.https: Flags [.], ack 10398, win 864, options [nop,nop,TS val 1527220 ecr 3899858173], length 0
23:47:14.178061 IP ip-192-168-1-10.us-west-2.compute.internal.45720 > sfo03s18-in-f10.1e100.net.https: Flags [.], ack 11746, win 887, options [nop,nop,TS val 1527220 ecr 3899858173], length 0
23:47:14.178693 IP sfo03s18-in-f10.1e100.net.https > ip-192-168-1-10.us-west-2.compute.internal.45720: Flags [.], seq 17138:18486, ack 3615, win 272, options [nop,nop,TS val 3899858181 ecr 1527191], length 1348
23:47:14.178738 IP sfo03s18-in-f10.1e100.net.https > ip-192-168-1-10.us-west-2.compute.internal.45720: Flags [.], seq 18486:19834, ack 3615, win 272, options [nop,nop,TS val 3899858181 ecr 1527191], length 1348
23:47:14.180164 IP ip-192-168-1-10.us-west-2.compute.internal.48856 > ec2-54-154-113-206.eu-west-1.compute.amazonaws.com.www: Flags [S], seq 130630374, win 65535, options [mss 1460,sackOK,TS val 1527220 ecr 0,nop,wscale 7], length 0
23:47:14.180180 IP ip-192-168-1-10.us-west-2.compute.internal.45720 > sfo03s18-in-f10.1e100.net.https: Flags [.], ack 13094, win 910, options [nop,nop,TS val 1527220 ecr 3899858176], length 0
23:47:14.181172 IP sfo03s18-in-f10.1e100.net.https > ip-192-168-1-10.us-west-2.compute.internal.45720: Flags [.], seq 19834:21182, ack 3615, win 272, options [nop,nop,TS val 3899858184 ecr 1527191], length 1348
23:47:14.181222 IP sfo03s18-in-f10.1e100.net.https > ip-192-168-1-10.us-west-2.compute.internal.45720: Flags [.], seq 21182:22530, ack 3615, win 272, options [nop,nop,TS val 3899858184 ecr 1527191], length 1348
23:47:14.187872 IP ec2-54-154-113-206.eu-west-1.compute.amazonaws.com.www > ip-192-168-1-10.us-west-2.compute.internal.48856: Flags [S.], seq 3646617373, ack 130630375, win 26960, options [mss 1360,sackOK,TS val 1004956727 ecr 1527220,nop,wscale 7], length 0
23:47:14.191931 IP ip-192-168-1-10.us-west-2.compute.internal.45720 > sfo03s18-in-f10.1e100.net.https: Flags [.], ack 14442, win 932, options [nop,nop,TS val 1527222 ecr 3899858176], length 0
23:47:14.191949 IP ip-192-168-1-10.us-west-2.compute.internal.45720 > sfo03s18-in-f10.1e100.net.https: Flags [.], ack 15790, win 955, options [nop,nop,TS val 1527223 ecr 3899858179], length 0
23:47:14.192800 IP ip-192-168-1-10.us-west-2.compute.internal.45720 > sfo03s18-in-f10.1e100.net.https: Flags [.], ack 17138, win 977, options [nop,nop,TS val 1527223 ecr 3899858179], length 0
23:47:14.196339 IP ip-192-168-1-10.us-west-2.compute.internal.45720 > sfo03s18-in-f10.1e100.net.https: Flags [.], ack 18486, win 1000, options [nop,nop,TS val 1527223 ecr 3899858181], length 0
23:47:14.196358 IP ip-192-168-1-10.us-west-2.compute.internal.45720 > sfo03s18-in-f10.1e100.net.https: Flags [.], ack 19834, win 1023, options [nop,nop,TS val 1527223 ecr 3899858181], length 0
23:47:14.196956 IP ip-192-168-1-10.us-west-2.compute.internal.45720 > sfo03s18-in-f10.1e100.net.https: Flags [.], ack 21182, win 1045, options [nop,nop,TS val 1527224 ecr 3899858184], length 0
23:47:14.198956 IP ip-192-168-1-10.us-west-2.compute.internal.45720 > sfo03s18-in-f10.1e100.net.https: Flags [.], ack 22530, win 1068, options [nop,nop,TS val 1527224 ecr 3899858184], length 0
23:47:14.199297 IP ip-192-168-1-10.us-west-2.compute.internal.48856 > ec2-54-154-113-206.eu-west-1.compute.amazonaws.com.www: Flags [.], ack 1, win 685, options [nop,nop,TS val 1527224 ecr 1004956727], length 0
23:47:14.201417 IP sfo03s18-in-f10.1e100.net.https > ip-192-168-1-10.us-west-2.compute.internal.45720: Flags [.], seq 22530:23878, ack 3615, win 272, options [nop,nop,TS val 3899858209 ecr 1527218], length 1348
23:47:14.201499 IP sfo03s18-in-f10.1e100.net.https > ip-192-168-1-10.us-west-2.compute.internal.45720: Flags [.], seq 23878:25226, ack 3615, win 272, options [nop,nop,TS val 3899858209 ecr 1527218], length 1348
23:47:14.203418 IP ip-192-168-1-10.us-west-2.compute.internal.48856 > ec2-54-154-113-206.eu-west-1.compute.amazonaws.com.www: Flags [P.], seq 1:155, ack 1, win 685, options [nop,nop,TS val 1527225 ecr 1004956727], length 154: HTTP: POST /ods.as HTTP/1.1
23:47:14.203436 IP ip-192-168-1-10.us-west-2.compute.internal.48856 > ec2-54-154-113-206.eu-west-1.compute.amazonaws.com.www: Flags [P.], seq 155:583, ack 1, win 685, options [nop,nop,TS val 1527225 ecr 1004956727], length 428: HTTP
23:47:14.205049 IP sfo03s18-in-f10.1e100.net.https > ip-192-168-1-10.us-west-2.compute.internal.45720: Flags [.], seq 25226:26574, ack 3615, win 272, options [nop,nop,TS val 3899858213 ecr 1527218], length 1348
23:47:14.205108 IP sfo03s18-in-f10.1e100.net.https > ip-192-168-1-10.us-west-2.compute.internal.45720: Flags [.], seq 26574:27922, ack 3615, win 272, options [nop,nop,TS val 3899858213 ecr 1527218], length 1348
23:47:14.207710 IP sfo03s18-in-f10.1e100.net.https > ip-192-168-1-10.us-west-2.compute.internal.45720: Flags [.], seq 27922:29270, ack 3615, win 272, options [nop,nop,TS val 3899858213 ecr 1527219], length 1348
23:47:14.207766 IP sfo03s18-in-f10.1e100.net.https > ip-192-168-1-10.us-west-2.compute.internal.45720: Flags [.], seq 29270:30618, ack 3615, win 272, options [nop,nop,TS val 3899858213 ecr 1527219], length 1348
23:47:14.208544 IP ip-192-168-1-10.us-west-2.compute.internal.45720 > sfo03s18-in-f10.1e100.net.https: Flags [.], ack 23878, win 1091, options [nop,nop,TS val 1527225 ecr 3899858209], length 0
23:47:14.208562 IP ip-192-168-1-10.us-west-2.compute.internal.45720 > sfo03s18-in-f10.1e100.net.https: Flags [.], ack 25226, win 1113, options [nop,nop,TS val 1527226 ecr 3899858209], length 0
23:47:14.210185 IP sfo03s18-in-f10.1e100.net.https > ip-192-168-1-10.us-west-2.compute.internal.45720: Flags [.], seq 30618:31966, ack 3615, win 272, options [nop,nop,TS val 3899858214 ecr 1527219], length 1348
23:47:14.210237 IP sfo03s18-in-f10.1e100.net.https > ip-192-168-1-10.us-west-2.compute.internal.45720: Flags [.], seq 31966:33314, ack 3615, win 272, options [nop,nop,TS val 3899858214 ecr 1527219], length 1348
23:47:14.211005 IP ec2-54-154-113-206.eu-west-1.compute.amazonaws.com.www > ip-192-168-1-10.us-west-2.compute.internal.48856: Flags [.], ack 155, win 219, options [nop,nop,TS val 1004956750 ecr 1527225], length 0
23:47:14.211172 IP ec2-54-154-113-206.eu-west-1.compute.amazonaws.com.www > ip-192-168-1-10.us-west-2.compute.internal.48856: Flags [.], ack 583, win 228, options [nop,nop,TS val 1004956750 ecr 1527225], length 0
23:47:14.212931 IP sfo03s18-in-f10.1e100.net.https > ip-192-168-1-10.us-west-2.compute.internal.45720: Flags [.], seq 33314:34662, ack 3615, win 272, options [nop,nop,TS val 3899858217 ecr 1527220], length 1348
23:47:14.213026 IP sfo03s18-in-f10.1e100.net.https > ip-192-168-1-10.us-west-2.compute.internal.45720: Flags [.], seq 34662:36010, ack 3615, win 272, options [nop,nop,TS val 3899858217 ecr 1527220], length 1348
23:47:14.213216 IP ip-192-168-1-10.us-west-2.compute.internal.45720 > sfo03s18-in-f10.1e100.net.https: Flags [.], ack 26574, win 1136, options [nop,nop,TS val 1527226 ecr 3899858213], length 0
23:47:14.213257 IP ip-192-168-1-10.us-west-2.compute.internal.45720 > sfo03s18-in-f10.1e100.net.https: Flags [.], ack 27922, win 1158, options [nop,nop,TS val 1527227 ecr 3899858213], length 0
23:47:14.213751 IP ip-192-168-1-10.us-west-2.compute.internal.45720 > sfo03s18-in-f10.1e100.net.https: Flags [.], ack 29270, win 1181, options [nop,nop,TS val 1527227 ecr 3899858213], length 0
23:47:14.215437 IP sfo03s18-in-f10.1e100.net.https > ip-192-168-1-10.us-west-2.compute.internal.45720: Flags [.], seq 36010:37358, ack 3615, win 272, options [nop,nop,TS val 3899858218 ecr 1527220], length 1348
23:47:14.215529 IP sfo03s18-in-f10.1e100.net.https > ip-192-168-1-10.us-west-2.compute.internal.45720: Flags [.], seq 37358:38706, ack 3615, win 272, options [nop,nop,TS val 3899858218 ecr 1527220], length 1348
23:47:14.217404 IP ip-192-168-1-10.us-west-2.compute.internal.45720 > sfo03s18-in-f10.1e100.net.https: Flags [.], ack 30618, win 1204, options [nop,nop,TS val 1527227 ecr 3899858213], length 0
23:47:14.217425 IP ip-192-168-1-10.us-west-2.compute.internal.45720 > sfo03s18-in-f10.1e100.net.https: Flags [.], ack 31966, win 1226, options [nop,nop,TS val 1527228 ecr 3899858214], length 0
23:47:14.217879 IP sfo03s18-in-f10.1e100.net.https > ip-192-168-1-10.us-west-2.compute.internal.45720: Flags [.], seq 38706:40054, ack 3615, win 272, options [nop,nop,TS val 3899858220 ecr 1527220], length 1348
23:47:14.221190 IP ip-192-168-1-10.us-west-2.compute.internal.45720 > sfo03s18-in-f10.1e100.net.https: Flags [.], ack 33314, win 1249, options [nop,nop,TS val 1527228 ecr 3899858214], length 0
23:47:14.221210 IP ip-192-168-1-10.us-west-2.compute.internal.45720 > sfo03s18-in-f10.1e100.net.https: Flags [.], ack 34662, win 1272, options [nop,nop,TS val 1527228 ecr 3899858217], length 0
23:47:14.223892 IP sfo03s18-in-f10.1e100.net.https > ip-192-168-1-10.us-west-2.compute.internal.45720: Flags [.], seq 40054:41402, ack 3615, win 272, options [nop,nop,TS val 3899858231 ecr 1527222], length 1348
23:47:14.225235 IP sfo03s18-in-f10.1e100.net.https > ip-192-168-1-10.us-west-2.compute.internal.45720: Flags [.], seq 41402:42750, ack 3615, win 272, options [nop,nop,TS val 3899858232 ecr 1527223], length 1348
23:47:14.225327 IP sfo03s18-in-f10.1e100.net.https > ip-192-168-1-10.us-west-2.compute.internal.45720: Flags [.], seq 42750:44098, ack 3615, win 272, options [nop,nop,TS val 3899858232 ecr 1527223], length 1348
23:47:14.225421 IP ip-192-168-1-10.us-west-2.compute.internal.45720 > sfo03s18-in-f10.1e100.net.https: Flags [.], ack 36010, win 1294, options [nop,nop,TS val 1527229 ecr 3899858217], length 0
23:47:14.225443 IP ip-192-168-1-10.us-west-2.compute.internal.45720 > sfo03s18-in-f10.1e100.net.https: Flags [.], ack 37358, win 1317, options [nop,nop,TS val 1527229 ecr 3899858218], length 0
23:47:14.228177 IP sfo03s18-in-f10.1e100.net.https > ip-192-168-1-10.us-west-2.compute.internal.45720: Flags [.], seq 44098:45446, ack 3615, win 272, options [nop,nop,TS val 3899858236 ecr 1527223], length 1348
23:47:14.229293 IP ip-192-168-1-10.us-west-2.compute.internal.45720 > sfo03s18-in-f10.1e100.net.https: Flags [.], ack 38706, win 1339, options [nop,nop,TS val 1527230 ecr 3899858218], length 0
23:47:14.229311 IP ip-192-168-1-10.us-west-2.compute.internal.45720 > sfo03s18-in-f10.1e100.net.https: Flags [.], ack 40054, win 1362, options [nop,nop,TS val 1527230 ecr 3899858220], length 0
23:47:14.229545 IP sfo03s18-in-f10.1e100.net.https > ip-192-168-1-10.us-west-2.compute.internal.45720: Flags [.], seq 45446:46794, ack 3615, win 272, options [nop,nop,TS val 3899858236 ecr 1527224], length 1348
23:47:14.229596 IP sfo03s18-in-f10.1e100.net.https > ip-192-168-1-10.us-west-2.compute.internal.45720: Flags [.], seq 46794:48142, ack 3615, win 272, options [nop,nop,TS val 3899858236 ecr 1527224], length 1348
23:47:14.232190 IP sfo03s18-in-f10.1e100.net.https > ip-192-168-1-10.us-west-2.compute.internal.45720: Flags [.], seq 48142:49490, ack 3615, win 272, options [nop,nop,TS val 3899858238 ecr 1527224], length 1348
23:47:14.232291 IP sfo03s18-in-f10.1e100.net.https > ip-192-168-1-10.us-west-2.compute.internal.45720: Flags [.], seq 49490:50838, ack 3615, win 272, options [nop,nop,TS val 3899858238 ecr 1527224], length 1348
23:47:14.233571 IP ip-192-168-1-10.us-west-2.compute.internal.45720 > sfo03s18-in-f10.1e100.net.https: Flags [.], ack 41402, win 1385, options [nop,nop,TS val 1527231 ecr 3899858231], length 0
23:47:14.233593 IP ip-192-168-1-10.us-west-2.compute.internal.45720 > sfo03s18-in-f10.1e100.net.https: Flags [.], ack 42750, win 1407, options [nop,nop,TS val 1527231 ecr 3899858232], length 0
23:47:14.237054 IP ip-192-168-1-10.us-west-2.compute.internal.45720 > sfo03s18-in-f10.1e100.net.https: Flags [.], ack 44098, win 1430, options [nop,nop,TS val 1527231 ecr 3899858232], length 0
23:47:14.237070 IP ip-192-168-1-10.us-west-2.compute.internal.45720 > sfo03s18-in-f10.1e100.net.https: Flags [.], ack 45446, win 1453, options [nop,nop,TS val 1527231 ecr 3899858236], length 0
23:47:14.237925 IP ip-192-168-1-10.us-west-2.compute.internal.45720 > sfo03s18-in-f10.1e100.net.https: Flags [.], ack 46794, win 1475, options [nop,nop,TS val 1527232 ecr 3899858236], length 0
23:47:14.240440 IP sfo03s18-in-f10.1e100.net.https > ip-192-168-1-10.us-west-2.compute.internal.45720: Flags [.], seq 50838:52186, ack 3615, win 272, options [nop,nop,TS val 3899858248 ecr 1527225], length 1348
23:47:14.240503 IP sfo03s18-in-f10.1e100.net.https > ip-192-168-1-10.us-west-2.compute.internal.45720: Flags [.], seq 52186:53534, ack 3615, win 272, options [nop,nop,TS val 3899858248 ecr 1527225], length 1348
23:47:14.242240 IP sfo03s18-in-f10.1e100.net.https > ip-192-168-1-10.us-west-2.compute.internal.45720: Flags [.], seq 53534:54882, ack 3615, win 272, options [nop,nop,TS val 3899858248 ecr 1527226], length 1348
23:47:14.242283 IP sfo03s18-in-f10.1e100.net.https > ip-192-168-1-10.us-west-2.compute.internal.45720: Flags [.], seq 54882:56230, ack 3615, win 272, options [nop,nop,TS val 3899858248 ecr 1527226], length 1348
23:47:14.243544 IP ip-192-168-1-10.us-west-2.compute.internal.45720 > sfo03s18-in-f10.1e100.net.https: Flags [.], ack 48142, win 1498, options [nop,nop,TS val 1527232 ecr 3899858236], length 0
23:47:14.243561 IP ip-192-168-1-10.us-west-2.compute.internal.45720 > sfo03s18-in-f10.1e100.net.https: Flags [.], ack 49490, win 1520, options [nop,nop,TS val 1527233 ecr 3899858238], length 0
23:47:14.243920 IP ip-192-168-1-10.us-west-2.compute.internal.45720 > sfo03s18-in-f10.1e100.net.https: Flags [.], ack 50838, win 1543, options [nop,nop,TS val 1527233 ecr 3899858238], length 0
23:47:14.245084 IP sfo03s18-in-f10.1e100.net.https > ip-192-168-1-10.us-west-2.compute.internal.45720: Flags [.], seq 56230:57578, ack 3615, win 272, options [nop,nop,TS val 3899858253 ecr 1527226], length 1348
23:47:14.245133 IP sfo03s18-in-f10.1e100.net.https > ip-192-168-1-10.us-west-2.compute.internal.45720: Flags [.], seq 57578:58926, ack 3615, win 272, options [nop,nop,TS val 3899858253 ecr 1527226], length 1348
23:47:14.246856 IP sfo03s18-in-f10.1e100.net.https > ip-192-168-1-10.us-west-2.compute.internal.45720: Flags [.], seq 58926:60274, ack 3615, win 272, options [nop,nop,TS val 3899858253 ecr 1527227], length 1348
23:47:14.246896 IP sfo03s18-in-f10.1e100.net.https > ip-192-168-1-10.us-west-2.compute.internal.45720: Flags [.], seq 60274:61622, ack 3615, win 272, options [nop,nop,TS val 3899858253 ecr 1527227], length 1348
23:47:14.248699 IP sfo03s18-in-f10.1e100.net.https > ip-192-168-1-10.us-west-2.compute.internal.45720: Flags [.], seq 61622:62970, ack 3615, win 272, options [nop,nop,TS val 3899858253 ecr 1527227], length 1348
23:47:14.248738 IP sfo03s18-in-f10.1e100.net.https > ip-192-168-1-10.us-west-2.compute.internal.45720: Flags [.], seq 62970:64318, ack 3615, win 272, options [nop,nop,TS val 3899858253 ecr 1527227], length 1348
23:47:14.248813 IP ip-192-168-1-10.us-west-2.compute.internal.45720 > sfo03s18-in-f10.1e100.net.https: Flags [.], ack 52186, win 1566, options [nop,nop,TS val 1527233 ecr 3899858248], length 0
23:47:14.248830 IP ip-192-168-1-10.us-west-2.compute.internal.45720 > sfo03s18-in-f10.1e100.net.https: Flags [.], ack 53534, win 1588, options [nop,nop,TS val 1527234 ecr 3899858248], length 0
23:47:14.249411 IP ip-192-168-1-10.us-west-2.compute.internal.45720 > sfo03s18-in-f10.1e100.net.https: Flags [.], ack 54882, win 1611, options [nop,nop,TS val 1527234 ecr 3899858248], length 0
23:47:14.250402 IP sfo03s18-in-f10.1e100.net.https > ip-192-168-1-10.us-west-2.compute.internal.45720: Flags [.], seq 64318:65666, ack 3615, win 272, options [nop,nop,TS val 3899858257 ecr 1527227], length 1348
23:47:14.250464 IP sfo03s18-in-f10.1e100.net.https > ip-192-168-1-10.us-west-2.compute.internal.45720: Flags [.], seq 65666:67014, ack 3615, win 272, options [nop,nop,TS val 3899858257 ecr 1527227], length 1348
23:47:14.252121 IP sfo03s18-in-f10.1e100.net.https > ip-192-168-1-10.us-west-2.compute.internal.45720: Flags [.], seq 67014:68362, ack 3615, win 272, options [nop,nop,TS val 3899858257 ecr 1527228], length 1348
23:47:14.252159 IP sfo03s18-in-f10.1e100.net.https > ip-192-168-1-10.us-west-2.compute.internal.45720: Flags [.], seq 68362:69710, ack 3615, win 272, options [nop,nop,TS val 3899858257 ecr 1527228], length 1348
23:47:14.253416 IP ip-192-168-1-10.us-west-2.compute.internal.45720 > sfo03s18-in-f10.1e100.net.https: Flags [.], ack 56230, win 1634, options [nop,nop,TS val 1527234 ecr 3899858248], length 0
23:47:14.253431 IP ip-192-168-1-10.us-west-2.compute.internal.45720 > sfo03s18-in-f10.1e100.net.https: Flags [.], ack 57578, win 1656, options [nop,nop,TS val 1527235 ecr 3899858253], length 0
23:47:14.254008 IP sfo03s18-in-f10.1e100.net.https > ip-192-168-1-10.us-west-2.compute.internal.45720: Flags [.], seq 69710:71058, ack 3615, win 272, options [nop,nop,TS val 3899858261 ecr 1527228], length 1348
23:47:14.254055 IP sfo03s18-in-f10.1e100.net.https > ip-192-168-1-10.us-west-2.compute.internal.45720: Flags [.], seq 71058:72406, ack 3615, win 272, options [nop,nop,TS val 3899858261 ecr 1527228], length 1348
23:47:14.254111 IP ip-192-168-1-10.us-west-2.compute.internal.45720 > sfo03s18-in-f10.1e100.net.https: Flags [.], ack 58926, win 1679, options [nop,nop,TS val 1527235 ecr 3899858253], length 0
23:47:14.255943 IP sfo03s18-in-f10.1e100.net.https > ip-192-168-1-10.us-west-2.compute.internal.45720: Flags [.], seq 72406:73754, ack 3615, win 272, options [nop,nop,TS val 3899858261 ecr 1527228], length 1348
23:47:14.255987 IP sfo03s18-in-f10.1e100.net.https > ip-192-168-1-10.us-west-2.compute.internal.45720: Flags [.], seq 73754:75102, ack 3615, win 272, options [nop,nop,TS val 3899858261 ecr 1527228], length 1348
23:47:14.257597 IP sfo03s18-in-f10.1e100.net.https > ip-192-168-1-10.us-west-2.compute.internal.45720: Flags [.], seq 75102:76450, ack 3615, win 272, options [nop,nop,TS val 3899858265 ecr 1527229], length 1348
23:47:14.257719 IP sfo03s18-in-f10.1e100.net.https > ip-192-168-1-10.us-west-2.compute.internal.45720: Flags [P.], seq 76450:77590, ack 3615, win 272, options [nop,nop,TS val 3899858265 ecr 1527229], length 1140
23:47:14.258097 IP ip-192-168-1-10.us-west-2.compute.internal.45720 > sfo03s18-in-f10.1e100.net.https: Flags [.], ack 60274, win 1701, options [nop,nop,TS val 1527235 ecr 3899858253], length 0
23:47:14.258118 IP ip-192-168-1-10.us-west-2.compute.internal.45720 > sfo03s18-in-f10.1e100.net.https: Flags [.], ack 61622, win 1724, options [nop,nop,TS val 1527236 ecr 3899858253], length 0
23:47:14.262848 IP ip-192-168-1-10.us-west-2.compute.internal.45720 > sfo03s18-in-f10.1e100.net.https: Flags [.], ack 62970, win 1747, options [nop,nop,TS val 1527236 ecr 3899858253], length 0
23:47:14.262886 IP ip-192-168-1-10.us-west-2.compute.internal.45720 > sfo03s18-in-f10.1e100.net.https: Flags [.], ack 64318, win 1769, options [nop,nop,TS val 1527237 ecr 3899858253], length 0
23:47:14.263185 IP ip-192-168-1-10.us-west-2.compute.internal.45720 > sfo03s18-in-f10.1e100.net.https: Flags [.], ack 65666, win 1792, options [nop,nop,TS val 1527237 ecr 3899858257], length 0
23:47:14.270181 IP ip-192-168-1-10.us-west-2.compute.internal.45720 > sfo03s18-in-f10.1e100.net.https: Flags [.], ack 67014, win 1815, options [nop,nop,TS val 1527238 ecr 3899858257], length 0
23:47:14.270195 IP ip-192-168-1-10.us-west-2.compute.internal.45720 > sfo03s18-in-f10.1e100.net.https: Flags [.], ack 68362, win 1837, options [nop,nop,TS val 1527238 ecr 3899858257], length 0
23:47:14.270421 IP ip-192-168-1-10.us-west-2.compute.internal.45720 > sfo03s18-in-f10.1e100.net.https: Flags [.], ack 69710, win 1860, options [nop,nop,TS val 1527238 ecr 3899858257], length 0
23:47:14.270435 IP ip-192-168-1-10.us-west-2.compute.internal.45720 > sfo03s18-in-f10.1e100.net.https: Flags [.], ack 71058, win 1882, options [nop,nop,TS val 1527238 ecr 3899858261], length 0
23:47:14.270574 IP ip-192-168-1-10.us-west-2.compute.internal.45720 > sfo03s18-in-f10.1e100.net.https: Flags [.], ack 72406, win 1905, options [nop,nop,TS val 1527238 ecr 3899858261], length 0
23:47:14.272043 IP ip-192-168-1-10.us-west-2.compute.internal.45720 > sfo03s18-in-f10.1e100.net.https: Flags [.], ack 73754, win 1928, options [nop,nop,TS val 1527238 ecr 3899858261], length 0
23:47:14.272162 IP ip-192-168-1-10.us-west-2.compute.internal.45720 > sfo03s18-in-f10.1e100.net.https: Flags [.], ack 75102, win 1950, options [nop,nop,TS val 1527239 ecr 3899858261], length 0
23:47:14.272537 IP ip-192-168-1-10.us-west-2.compute.internal.45720 > sfo03s18-in-f10.1e100.net.https: Flags [.], ack 76450, win 1973, options [nop,nop,TS val 1527239 ecr 3899858265], length 0
23:47:14.272658 IP ip-192-168-1-10.us-west-2.compute.internal.45720 > sfo03s18-in-f10.1e100.net.https: Flags [.], ack 77590, win 1994, options [nop,nop,TS val 1527239 ecr 3899858265], length 0
23:47:14.589790 IP ip-192-168-1-10.us-west-2.compute.internal.56248 > sea30s02-in-f14.1e100.net.https: Flags [S], seq 2264588058, win 65535, options [mss 1460,sackOK,TS val 1527302 ecr 0,nop,wscale 7], length 0
23:47:14.605140 IP sea30s02-in-f14.1e100.net.https > ip-192-168-1-10.us-west-2.compute.internal.56248: Flags [S.], seq 4032214665, ack 2264588059, win 60192, options [mss 1360,sackOK,TS val 1842912597 ecr 1527302,nop,wscale 8], length 0
23:47:14.606745 IP ip-192-168-1-10.us-west-2.compute.internal.56248 > sea30s02-in-f14.1e100.net.https: Flags [.], ack 1, win 685, options [nop,nop,TS val 1527306 ecr 1842912597], length 0
23:47:14.614233 IP ip-192-168-1-10.us-west-2.compute.internal.56248 > sea30s02-in-f14.1e100.net.https: Flags [P.], seq 1:195, ack 1, win 685, options [nop,nop,TS val 1527307 ecr 1842912597], length 194
23:47:14.629785 IP sea30s02-in-f14.1e100.net.https > ip-192-168-1-10.us-west-2.compute.internal.56248: Flags [.], ack 195, win 240, options [nop,nop,TS val 1842912622 ecr 1527307], length 0
23:47:14.638340 IP sea30s02-in-f14.1e100.net.https > ip-192-168-1-10.us-west-2.compute.internal.56248: Flags [.], seq 1:1349, ack 195, win 240, options [nop,nop,TS val 1842912630 ecr 1527307], length 1348
23:47:14.638465 IP sea30s02-in-f14.1e100.net.https > ip-192-168-1-10.us-west-2.compute.internal.56248: Flags [.], seq 1349:2697, ack 195, win 240, options [nop,nop,TS val 1842912630 ecr 1527307], length 1348
23:47:14.639326 IP sea30s02-in-f14.1e100.net.https > ip-192-168-1-10.us-west-2.compute.internal.56248: Flags [P.], seq 2697:3830, ack 195, win 240, options [nop,nop,TS val 1842912630 ecr 1527307], length 1133
23:47:14.643363 IP ip-192-168-1-10.us-west-2.compute.internal.56248 > sea30s02-in-f14.1e100.net.https: Flags [.], ack 1349, win 707, options [nop,nop,TS val 1527313 ecr 1842912630], length 0
23:47:14.643582 IP ip-192-168-1-10.us-west-2.compute.internal.56248 > sea30s02-in-f14.1e100.net.https: Flags [.], ack 2697, win 730, options [nop,nop,TS val 1527313 ecr 1842912630], length 0
23:47:14.644180 IP ip-192-168-1-10.us-west-2.compute.internal.56248 > sea30s02-in-f14.1e100.net.https: Flags [.], ack 3830, win 751, options [nop,nop,TS val 1527313 ecr 1842912630], length 0
23:47:14.711873 IP ip-192-168-1-10.us-west-2.compute.internal.56248 > sea30s02-in-f14.1e100.net.https: Flags [P.], seq 195:202, ack 3830, win 751, options [nop,nop,TS val 1527327 ecr 1842912630], length 7
23:47:14.712190 IP ip-192-168-1-10.us-west-2.compute.internal.56248 > sea30s02-in-f14.1e100.net.https: Flags [R.], seq 202, ack 3830, win 751, options [nop,nop,TS val 1527327 ecr 1842912630], length 0
23:47:14.719728 IP ip-192-168-1-10.us-west-2.compute.internal.39407 > sea30s02-in-f14.1e100.net.https: Flags [S], seq 1531121200, win 65535, options [mss 1460,sackOK,TS val 1527328 ecr 0,nop,wscale 7], length 0
23:47:14.727282 IP sea30s02-in-f14.1e100.net.https > ip-192-168-1-10.us-west-2.compute.internal.56248: Flags [F.], seq 3830, ack 202, win 240, options [nop,nop,TS val 1842912719 ecr 1527327], length 0
23:47:14.728861 IP ip-192-168-1-10.us-west-2.compute.internal.56248 > sea30s02-in-f14.1e100.net.https: Flags [R], seq 2264588260, win 0, length 0
23:47:14.734754 IP sea30s02-in-f14.1e100.net.https > ip-192-168-1-10.us-west-2.compute.internal.39407: Flags [S.], seq 2323517532, ack 1531121201, win 60192, options [mss 1360,sackOK,TS val 982301565 ecr 1527328,nop,wscale 8], length 0
23:47:14.736372 IP ip-192-168-1-10.us-west-2.compute.internal.39407 > sea30s02-in-f14.1e100.net.https: Flags [.], ack 1, win 685, options [nop,nop,TS val 1527331 ecr 982301565], length 0
23:47:14.742107 IP ip-192-168-1-10.us-west-2.compute.internal.39407 > sea30s02-in-f14.1e100.net.https: Flags [P.], seq 1:195, ack 1, win 685, options [nop,nop,TS val 1527333 ecr 982301565], length 194
23:47:14.754864 IP ec2-54-154-113-206.eu-west-1.compute.amazonaws.com.www > ip-192-168-1-10.us-west-2.compute.internal.48856: Flags [P.], seq 1:565, ack 583, win 228, options [nop,nop,TS val 1004957294 ecr 1527225], length 564: HTTP: HTTP/1.1 200 OK
23:47:14.755035 IP ec2-54-154-113-206.eu-west-1.compute.amazonaws.com.www > ip-192-168-1-10.us-west-2.compute.internal.48856: Flags [P.], seq 565:918, ack 583, win 228, options [nop,nop,TS val 1004957294 ecr 1527225], length 353: HTTP
23:47:14.756961 IP ip-192-168-1-10.us-west-2.compute.internal.48856 > ec2-54-154-113-206.eu-west-1.compute.amazonaws.com.www: Flags [.], ack 565, win 694, options [nop,nop,TS val 1527336 ecr 1004957294], length 0
23:47:14.757175 IP ip-192-168-1-10.us-west-2.compute.internal.48856 > ec2-54-154-113-206.eu-west-1.compute.amazonaws.com.www: Flags [.], ack 918, win 702, options [nop,nop,TS val 1527336 ecr 1004957294], length 0
23:47:14.757621 IP sea30s02-in-f14.1e100.net.https > ip-192-168-1-10.us-west-2.compute.internal.39407: Flags [.], ack 195, win 240, options [nop,nop,TS val 982301588 ecr 1527333], length 0
23:47:14.767175 IP sea30s02-in-f14.1e100.net.https > ip-192-168-1-10.us-west-2.compute.internal.39407: Flags [.], seq 1:1349, ack 195, win 240, options [nop,nop,TS val 982301598 ecr 1527333], length 1348
23:47:14.767281 IP sea30s02-in-f14.1e100.net.https > ip-192-168-1-10.us-west-2.compute.internal.39407: Flags [.], seq 1349:2697, ack 195, win 240, options [nop,nop,TS val 982301598 ecr 1527333], length 1348
23:47:14.768138 IP sea30s02-in-f14.1e100.net.https > ip-192-168-1-10.us-west-2.compute.internal.39407: Flags [P.], seq 2697:3830, ack 195, win 240, options [nop,nop,TS val 982301598 ecr 1527333], length 1133
23:47:14.770199 IP ip-192-168-1-10.us-west-2.compute.internal.39407 > sea30s02-in-f14.1e100.net.https: Flags [.], ack 1349, win 707, options [nop,nop,TS val 1527338 ecr 982301598], length 0
23:47:14.770425 IP ip-192-168-1-10.us-west-2.compute.internal.39407 > sea30s02-in-f14.1e100.net.https: Flags [.], ack 2697, win 730, options [nop,nop,TS val 1527338 ecr 982301598], length 0
23:47:14.770797 IP ip-192-168-1-10.us-west-2.compute.internal.39407 > sea30s02-in-f14.1e100.net.https: Flags [.], ack 3830, win 751, options [nop,nop,TS val 1527338 ecr 982301598], length 0
23:47:14.776756 IP ip-192-168-1-10.us-west-2.compute.internal.39407 > sea30s02-in-f14.1e100.net.https: Flags [P.], seq 195:202, ack 3830, win 751, options [nop,nop,TS val 1527340 ecr 982301598], length 7
